{
  "allowed_skills": [
    "watch",
    "raise_alarm",
    "escalate"
  ],
  "created_at": "2026-04-22T00:00:00Z",
  "evidence_refs": [
    "generated/multi_office_train_clean_flow/release_train.json"
  ],
  "id": "office_task_skill_boundary_v1_example",
  "kind": "office_task_skill_boundary_v1",
  "notes": "Example artifact for office_task_skill_boundary_v1.",
  "office_id": "monitor.assistant",
  "owner_repo": "aoa-skills",
  "status": "draft",
  "version": "1.1.0"
}